{"bytecode":{"base":{"kind":"memory-chain","local_index":10,"memory_index":0,"offsets":[1708,20],"value_type":"i32"},"length":{"kind":"memory-chain","local_index":10,"memory_index":0,"offsets":[1708,24],"value_type":"i32"},"memory_index":0},"dispatch_module_offset":132727,"function_index":414,"import_call_offsets":[26646],"module_sha256":"4d2f9f8adf28c48ed273515b815e05ae9a698b54955f7348e951faf43b1febc3","opcode":{"endian":"little","width":1},"pc":{"adjustment":"0","local_index":320,"subtract_memory_base":true,"value_type":"i32"},"sample_limit":256,"version":1}